<?xml version="1.0" encoding="UTF-8" standalone="yes"?>
<xs:schema version="1.0" xmlns:xs="http://www.w3.org/2001/XMLSchema">
	<xs:element name="mentee_exp_limit_table">
		<xs:complexType>
			<xs:sequence>
				<xs:element name="level" minOccurs="0" maxOccurs="unbounded">
					<xs:complexType>
						<xs:attribute name="lvl" type="xs:int" use="required"/>
						<xs:attribute name="exp_limit" type="xs:long" use="required"/>
					</xs:complexType>
				</xs:element>
			</xs:sequence>
		</xs:complexType>
	</xs:element>
</xs:schema>
